{
  "id": "CCD-UI-EXC-0001",
  "ruleId": "CCD-UI-064",
  "scope": ["packages/vue-ui/src/ProTable/ProTable.vue"],
  "justification": "Documented three-file deep-selector whitelist entry for frozen-column z-index management that cannot be expressed via PT.",
  "authority": ".ai/rules/components/01-primevue-pt-styling.mdc",
  "approvedBy": "architecture-review",
  "createdAt": "2026-07-15T00:00:00Z",
  "expiresAt": "2027-07-15T00:00:00Z"
}
